{
  "schemaVersion": 1,
  "reportId": "prbr-f17fb6b402d736f1a455",
  "policyId": "recipe-production-pipeline-v1",
  "policyVersion": "1.0.0",
  "contractId": "ydm-v1-production-corpus",
  "contractVersion": "1.0.0",
  "jobId": "batch-9d099023ecf104",
  "intakeId": "scale-intake-8b00578bafdef08a023d",
  "inputSnapshotId": "snapshot-1.0.0-production-scale-500-119d955b66be",
  "referenceDataVersion": "1.0.0",
  "referenceDataDigest": "56f3949bd1c0348f8fe65861ebcda23c2a198805cd2e9f70b00610a328753b52",
  "candidateCount": 25,
  "acceptedCount": 20,
  "terminalCount": 25,
  "reviewBacklogCount": 0,
  "dispositionCounts": {
    "accepted": 20,
    "rejected": 5,
    "duplicate": 0,
    "needs_reference_review": 0,
    "needs_recipe_review": 0,
    "nutrition_outlier": 0
  },
  "candidates": [
    {
      "candidateId": "scale-8b00578baf-001-45b753",
      "disposition": "accepted",
      "terminal": true,
      "intakeState": "accepted",
      "code": null,
      "detail": null,
      "failedStage": null,
      "qualityScore": 100,
      "recipeVersionId": "recver_be0bc93f1fbb3278aee0ac6c_v1",
      "warnings": []
    },
    {
      "candidateId": "scale-8b00578baf-002-3167da",
      "disposition": "accepted",
      "terminal": true,
      "intakeState": "accepted",
      "code": null,
      "detail": null,
      "failedStage": null,
      "qualityScore": 100,
      "recipeVersionId": "recver_a7733914cd4d5542e63a2c6c_v1",
      "warnings": []
    },
    {
      "candidateId": "scale-8b00578baf-003-d39c3e",
      "disposition": "accepted",
      "terminal": true,
      "intakeState": "accepted",
      "code": null,
      "detail": null,
      "failedStage": null,
      "qualityScore": 100,
      "recipeVersionId": "recver_8298c16bf158b5fb4a22189b_v1",
      "warnings": []
    },
    {
      "candidateId": "scale-8b00578baf-004-79ed85",
      "disposition": "accepted",
      "terminal": true,
      "intakeState": "accepted",
      "code": null,
      "detail": null,
      "failedStage": null,
      "qualityScore": 100,
      "recipeVersionId": "recver_b2313caef217b782027a01c0_v1",
      "warnings": []
    },
    {
      "candidateId": "scale-8b00578baf-005-0acaa9",
      "disposition": "accepted",
      "terminal": true,
      "intakeState": "accepted",
      "code": null,
      "detail": null,
      "failedStage": null,
      "qualityScore": 100,
      "recipeVersionId": "recver_eb5c968fdd24b55b3d85e3f3_v1",
      "warnings": []
    },
    {
      "candidateId": "scale-8b00578baf-006-898fb7",
      "disposition": "accepted",
      "terminal": true,
      "intakeState": "accepted",
      "code": null,
      "detail": null,
      "failedStage": null,
      "qualityScore": 100,
      "recipeVersionId": "recver_5a361b720dd2979972c9d201_v1",
      "warnings": []
    },
    {
      "candidateId": "scale-8b00578baf-007-d96f4c",
      "disposition": "accepted",
      "terminal": true,
      "intakeState": "accepted",
      "code": null,
      "detail": null,
      "failedStage": null,
      "qualityScore": 100,
      "recipeVersionId": "recver_17954994b2945219dddd603f_v1",
      "warnings": []
    },
    {
      "candidateId": "scale-8b00578baf-008-8d0d4c",
      "disposition": "accepted",
      "terminal": true,
      "intakeState": "accepted",
      "code": null,
      "detail": null,
      "failedStage": null,
      "qualityScore": 100,
      "recipeVersionId": "recver_8ba3d2c74fbcff528f46575b_v1",
      "warnings": []
    },
    {
      "candidateId": "scale-8b00578baf-009-1c6863",
      "disposition": "accepted",
      "terminal": true,
      "intakeState": "accepted",
      "code": null,
      "detail": null,
      "failedStage": null,
      "qualityScore": 100,
      "recipeVersionId": "recver_997301d73e95a488cc864954_v1",
      "warnings": []
    },
    {
      "candidateId": "scale-8b00578baf-010-57cdc0",
      "disposition": "accepted",
      "terminal": true,
      "intakeState": "accepted",
      "code": null,
      "detail": null,
      "failedStage": null,
      "qualityScore": 100,
      "recipeVersionId": "recver_f93864857285080eb4a28b82_v1",
      "warnings": []
    },
    {
      "candidateId": "scale-8b00578baf-011-459fec",
      "disposition": "accepted",
      "terminal": true,
      "intakeState": "accepted",
      "code": null,
      "detail": null,
      "failedStage": null,
      "qualityScore": 100,
      "recipeVersionId": "recver_156955e983dc0c3480e4f3c4_v1",
      "warnings": []
    },
    {
      "candidateId": "scale-8b00578baf-012-647d79",
      "disposition": "accepted",
      "terminal": true,
      "intakeState": "accepted",
      "code": null,
      "detail": null,
      "failedStage": null,
      "qualityScore": 100,
      "recipeVersionId": "recver_9483aad162af00173a7ee259_v1",
      "warnings": []
    },
    {
      "candidateId": "scale-8b00578baf-013-c11b67",
      "disposition": "accepted",
      "terminal": true,
      "intakeState": "accepted",
      "code": null,
      "detail": null,
      "failedStage": null,
      "qualityScore": 100,
      "recipeVersionId": "recver_2d772cd850bb30414cc4330d_v1",
      "warnings": []
    },
    {
      "candidateId": "scale-8b00578baf-014-ec930e",
      "disposition": "accepted",
      "terminal": true,
      "intakeState": "accepted",
      "code": null,
      "detail": null,
      "failedStage": null,
      "qualityScore": 100,
      "recipeVersionId": "recver_f524b48d6026452ef6439d84_v1",
      "warnings": []
    },
    {
      "candidateId": "scale-8b00578baf-015-8ed99b",
      "disposition": "accepted",
      "terminal": true,
      "intakeState": "accepted",
      "code": null,
      "detail": null,
      "failedStage": null,
      "qualityScore": 100,
      "recipeVersionId": "recver_6241f984a7878c9b6640fe9f_v1",
      "warnings": []
    },
    {
      "candidateId": "scale-8b00578baf-016-21ba2e",
      "disposition": "accepted",
      "terminal": true,
      "intakeState": "accepted",
      "code": null,
      "detail": null,
      "failedStage": null,
      "qualityScore": 100,
      "recipeVersionId": "recver_2e073a9464d969e64472c754_v1",
      "warnings": []
    },
    {
      "candidateId": "scale-8b00578baf-017-154d26",
      "disposition": "accepted",
      "terminal": true,
      "intakeState": "accepted",
      "code": null,
      "detail": null,
      "failedStage": null,
      "qualityScore": 100,
      "recipeVersionId": "recver_78cc6e848c39d4decbc0a873_v1",
      "warnings": []
    },
    {
      "candidateId": "scale-8b00578baf-018-0eac67",
      "disposition": "accepted",
      "terminal": true,
      "intakeState": "accepted",
      "code": null,
      "detail": null,
      "failedStage": null,
      "qualityScore": 100,
      "recipeVersionId": "recver_648e2ff19fc52590c08cc417_v1",
      "warnings": []
    },
    {
      "candidateId": "scale-8b00578baf-019-54c4bd",
      "disposition": "accepted",
      "terminal": true,
      "intakeState": "accepted",
      "code": null,
      "detail": null,
      "failedStage": null,
      "qualityScore": 100,
      "recipeVersionId": "recver_a356f626db75fa565c74a727_v1",
      "warnings": []
    },
    {
      "candidateId": "scale-8b00578baf-020-43a9c0",
      "disposition": "accepted",
      "terminal": true,
      "intakeState": "accepted",
      "code": null,
      "detail": null,
      "failedStage": null,
      "qualityScore": 100,
      "recipeVersionId": "recver_7993c72b28d2c7916c90e712_v1",
      "warnings": []
    },
    {
      "candidateId": "scale-8b00578baf-021-b8c3e3",
      "disposition": "rejected",
      "terminal": true,
      "intakeState": "rejected",
      "code": "target_already_reached",
      "detail": null,
      "failedStage": "schema_provenance",
      "qualityScore": 95,
      "recipeVersionId": null,
      "warnings": []
    },
    {
      "candidateId": "scale-8b00578baf-022-74d484",
      "disposition": "rejected",
      "terminal": true,
      "intakeState": "rejected",
      "code": "target_already_reached",
      "detail": null,
      "failedStage": "schema_provenance",
      "qualityScore": 95,
      "recipeVersionId": null,
      "warnings": []
    },
    {
      "candidateId": "scale-8b00578baf-023-332e04",
      "disposition": "rejected",
      "terminal": true,
      "intakeState": "rejected",
      "code": "target_already_reached",
      "detail": null,
      "failedStage": "schema_provenance",
      "qualityScore": 95,
      "recipeVersionId": null,
      "warnings": []
    },
    {
      "candidateId": "scale-8b00578baf-024-a91823",
      "disposition": "rejected",
      "terminal": true,
      "intakeState": "rejected",
      "code": "target_already_reached",
      "detail": null,
      "failedStage": "schema_provenance",
      "qualityScore": 95,
      "recipeVersionId": null,
      "warnings": []
    },
    {
      "candidateId": "scale-8b00578baf-025-e6a282",
      "disposition": "rejected",
      "terminal": true,
      "intakeState": "rejected",
      "code": "target_already_reached",
      "detail": null,
      "failedStage": "schema_provenance",
      "qualityScore": 95,
      "recipeVersionId": null,
      "warnings": []
    }
  ],
  "batchGate": {
    "status": "pass",
    "targetMet": true,
    "diversityPassed": true,
    "reviewBacklogCount": 0,
    "blockers": []
  },
  "resultDigest": "f17fb6b402d736f1a455f78693d1b863ae46f3f4de92bb52774bba013bf5afd8",
  "processedAt": "2026-09-07T08:10:14.170Z"
}
