{
  "schemaVersion": 1,
  "reportId": "prbr-5009f3268075632b4c89",
  "policyId": "recipe-production-pipeline-v1",
  "policyVersion": "1.0.0",
  "contractId": "ydm-v1-production-corpus",
  "contractVersion": "1.0.0",
  "jobId": "batch-86bb7b0bec4073",
  "intakeId": "scale-intake-cb15aab9c3f7c327a4e7",
  "inputSnapshotId": "snapshot-1.0.0-production-scale-500-6015ea0db891",
  "referenceDataVersion": "1.0.0",
  "referenceDataDigest": "56f3949bd1c0348f8fe65861ebcda23c2a198805cd2e9f70b00610a328753b52",
  "candidateCount": 13,
  "acceptedCount": 10,
  "terminalCount": 13,
  "reviewBacklogCount": 0,
  "dispositionCounts": {
    "accepted": 10,
    "rejected": 3,
    "duplicate": 0,
    "needs_reference_review": 0,
    "needs_recipe_review": 0,
    "nutrition_outlier": 0
  },
  "candidates": [
    {
      "candidateId": "scale-cb15aab9c3-001-3d524d",
      "disposition": "accepted",
      "terminal": true,
      "intakeState": "accepted",
      "code": null,
      "detail": null,
      "failedStage": null,
      "qualityScore": 100,
      "recipeVersionId": "recver_51c85c7eede975804b3c74b9_v1",
      "warnings": []
    },
    {
      "candidateId": "scale-cb15aab9c3-002-9f1075",
      "disposition": "accepted",
      "terminal": true,
      "intakeState": "accepted",
      "code": null,
      "detail": null,
      "failedStage": null,
      "qualityScore": 100,
      "recipeVersionId": "recver_0adcd51ac55a872029927063_v1",
      "warnings": []
    },
    {
      "candidateId": "scale-cb15aab9c3-003-84018e",
      "disposition": "accepted",
      "terminal": true,
      "intakeState": "accepted",
      "code": null,
      "detail": null,
      "failedStage": null,
      "qualityScore": 100,
      "recipeVersionId": "recver_2a9998e6d3c81296eb057b1d_v1",
      "warnings": []
    },
    {
      "candidateId": "scale-cb15aab9c3-004-dcdbe5",
      "disposition": "accepted",
      "terminal": true,
      "intakeState": "accepted",
      "code": null,
      "detail": null,
      "failedStage": null,
      "qualityScore": 100,
      "recipeVersionId": "recver_fddf25e39675cdcf87194049_v1",
      "warnings": []
    },
    {
      "candidateId": "scale-cb15aab9c3-005-303f7f",
      "disposition": "accepted",
      "terminal": true,
      "intakeState": "accepted",
      "code": null,
      "detail": null,
      "failedStage": null,
      "qualityScore": 100,
      "recipeVersionId": "recver_f777081cbab09474be43d960_v1",
      "warnings": []
    },
    {
      "candidateId": "scale-cb15aab9c3-006-348cb8",
      "disposition": "accepted",
      "terminal": true,
      "intakeState": "accepted",
      "code": null,
      "detail": null,
      "failedStage": null,
      "qualityScore": 100,
      "recipeVersionId": "recver_5a8b6b1347b776f76453b7f8_v1",
      "warnings": []
    },
    {
      "candidateId": "scale-cb15aab9c3-007-f83480",
      "disposition": "accepted",
      "terminal": true,
      "intakeState": "accepted",
      "code": null,
      "detail": null,
      "failedStage": null,
      "qualityScore": 100,
      "recipeVersionId": "recver_9eba149526de64251f6fde23_v1",
      "warnings": []
    },
    {
      "candidateId": "scale-cb15aab9c3-008-4a58dc",
      "disposition": "accepted",
      "terminal": true,
      "intakeState": "accepted",
      "code": null,
      "detail": null,
      "failedStage": null,
      "qualityScore": 100,
      "recipeVersionId": "recver_ecf5c8c5e5305fda0eb1136e_v1",
      "warnings": []
    },
    {
      "candidateId": "scale-cb15aab9c3-009-057e80",
      "disposition": "accepted",
      "terminal": true,
      "intakeState": "accepted",
      "code": null,
      "detail": null,
      "failedStage": null,
      "qualityScore": 100,
      "recipeVersionId": "recver_13077b93f13832628b02ce07_v1",
      "warnings": []
    },
    {
      "candidateId": "scale-cb15aab9c3-010-c9d609",
      "disposition": "accepted",
      "terminal": true,
      "intakeState": "accepted",
      "code": null,
      "detail": null,
      "failedStage": null,
      "qualityScore": 100,
      "recipeVersionId": "recver_915a997195700eca364a91c8_v1",
      "warnings": []
    },
    {
      "candidateId": "scale-cb15aab9c3-011-8bb27d",
      "disposition": "rejected",
      "terminal": true,
      "intakeState": "rejected",
      "code": "target_already_reached",
      "detail": null,
      "failedStage": "schema_provenance",
      "qualityScore": 95,
      "recipeVersionId": null,
      "warnings": []
    },
    {
      "candidateId": "scale-cb15aab9c3-012-d947e2",
      "disposition": "rejected",
      "terminal": true,
      "intakeState": "rejected",
      "code": "target_already_reached",
      "detail": null,
      "failedStage": "schema_provenance",
      "qualityScore": 95,
      "recipeVersionId": null,
      "warnings": []
    },
    {
      "candidateId": "scale-cb15aab9c3-013-72bc39",
      "disposition": "rejected",
      "terminal": true,
      "intakeState": "rejected",
      "code": "target_already_reached",
      "detail": null,
      "failedStage": "schema_provenance",
      "qualityScore": 95,
      "recipeVersionId": null,
      "warnings": []
    }
  ],
  "batchGate": {
    "status": "pass",
    "targetMet": true,
    "diversityPassed": true,
    "reviewBacklogCount": 0,
    "blockers": []
  },
  "resultDigest": "5009f3268075632b4c8974d2227d69136587cdfbcfdd54003dc99bb92511ce1a",
  "processedAt": "2026-09-07T08:09:37.782Z"
}
