{
  "schemaVersion": 1,
  "reportId": "prbr-349a4425354c2f3b4774",
  "policyId": "recipe-production-pipeline-v1",
  "policyVersion": "1.0.0",
  "contractId": "ydm-v1-production-corpus",
  "contractVersion": "1.0.0",
  "jobId": "batch-c4416af308c5fb",
  "intakeId": "scale-intake-00fe9d885c445416db49",
  "inputSnapshotId": "snapshot-1.0.0-production-scale-001-bcb4ffaee5c4",
  "referenceDataVersion": "1.0.0",
  "referenceDataDigest": "56f3949bd1c0348f8fe65861ebcda23c2a198805cd2e9f70b00610a328753b52",
  "candidateCount": 20,
  "acceptedCount": 16,
  "terminalCount": 20,
  "reviewBacklogCount": 0,
  "dispositionCounts": {
    "accepted": 16,
    "rejected": 4,
    "duplicate": 0,
    "needs_reference_review": 0,
    "needs_recipe_review": 0,
    "nutrition_outlier": 0
  },
  "candidates": [
    {
      "candidateId": "scale-00fe9d885c-001-c41cfd",
      "disposition": "accepted",
      "terminal": true,
      "intakeState": "accepted",
      "code": null,
      "detail": null,
      "failedStage": null,
      "qualityScore": 100,
      "recipeVersionId": "recver_d4fa23adc8486f1e386e6c7c_v1",
      "warnings": []
    },
    {
      "candidateId": "scale-00fe9d885c-002-768bac",
      "disposition": "accepted",
      "terminal": true,
      "intakeState": "accepted",
      "code": null,
      "detail": null,
      "failedStage": null,
      "qualityScore": 100,
      "recipeVersionId": "recver_35decef20253d1466cb4ba5f_v1",
      "warnings": []
    },
    {
      "candidateId": "scale-00fe9d885c-003-09e051",
      "disposition": "accepted",
      "terminal": true,
      "intakeState": "accepted",
      "code": null,
      "detail": null,
      "failedStage": null,
      "qualityScore": 100,
      "recipeVersionId": "recver_9b57f5dd8ae9bd656f646a9e_v1",
      "warnings": []
    },
    {
      "candidateId": "scale-00fe9d885c-004-2630b8",
      "disposition": "accepted",
      "terminal": true,
      "intakeState": "accepted",
      "code": null,
      "detail": null,
      "failedStage": null,
      "qualityScore": 100,
      "recipeVersionId": "recver_647e4fd69a774c7be85a8c22_v1",
      "warnings": []
    },
    {
      "candidateId": "scale-00fe9d885c-005-509ac5",
      "disposition": "accepted",
      "terminal": true,
      "intakeState": "accepted",
      "code": null,
      "detail": null,
      "failedStage": null,
      "qualityScore": 100,
      "recipeVersionId": "recver_010ad8d5d34e4ad608b36f66_v1",
      "warnings": []
    },
    {
      "candidateId": "scale-00fe9d885c-006-e863e3",
      "disposition": "accepted",
      "terminal": true,
      "intakeState": "accepted",
      "code": null,
      "detail": null,
      "failedStage": null,
      "qualityScore": 100,
      "recipeVersionId": "recver_b1ffd2870702fc9e7be62330_v1",
      "warnings": []
    },
    {
      "candidateId": "scale-00fe9d885c-007-e19db4",
      "disposition": "accepted",
      "terminal": true,
      "intakeState": "accepted",
      "code": null,
      "detail": null,
      "failedStage": null,
      "qualityScore": 100,
      "recipeVersionId": "recver_e7337a371a18bc8283ad5921_v1",
      "warnings": []
    },
    {
      "candidateId": "scale-00fe9d885c-008-e466aa",
      "disposition": "accepted",
      "terminal": true,
      "intakeState": "accepted",
      "code": null,
      "detail": null,
      "failedStage": null,
      "qualityScore": 100,
      "recipeVersionId": "recver_559a69dcd52f9bc3db124f69_v1",
      "warnings": []
    },
    {
      "candidateId": "scale-00fe9d885c-009-d5980d",
      "disposition": "accepted",
      "terminal": true,
      "intakeState": "accepted",
      "code": null,
      "detail": null,
      "failedStage": null,
      "qualityScore": 100,
      "recipeVersionId": "recver_967f671f6672edc0d7e729e0_v1",
      "warnings": []
    },
    {
      "candidateId": "scale-00fe9d885c-010-fa612b",
      "disposition": "accepted",
      "terminal": true,
      "intakeState": "accepted",
      "code": null,
      "detail": null,
      "failedStage": null,
      "qualityScore": 100,
      "recipeVersionId": "recver_cb4511fe5e95bb29ce531347_v1",
      "warnings": []
    },
    {
      "candidateId": "scale-00fe9d885c-011-51f4fd",
      "disposition": "accepted",
      "terminal": true,
      "intakeState": "accepted",
      "code": null,
      "detail": null,
      "failedStage": null,
      "qualityScore": 100,
      "recipeVersionId": "recver_7f16ef32f15b992b6c616696_v1",
      "warnings": []
    },
    {
      "candidateId": "scale-00fe9d885c-012-9fdf85",
      "disposition": "accepted",
      "terminal": true,
      "intakeState": "accepted",
      "code": null,
      "detail": null,
      "failedStage": null,
      "qualityScore": 100,
      "recipeVersionId": "recver_2718b2f3e44189ffe63d2108_v1",
      "warnings": []
    },
    {
      "candidateId": "scale-00fe9d885c-013-071d31",
      "disposition": "accepted",
      "terminal": true,
      "intakeState": "accepted",
      "code": null,
      "detail": null,
      "failedStage": null,
      "qualityScore": 100,
      "recipeVersionId": "recver_c431ea9868853cb16c787b92_v1",
      "warnings": []
    },
    {
      "candidateId": "scale-00fe9d885c-014-02eb93",
      "disposition": "accepted",
      "terminal": true,
      "intakeState": "accepted",
      "code": null,
      "detail": null,
      "failedStage": null,
      "qualityScore": 100,
      "recipeVersionId": "recver_f846393f751406035c96f217_v1",
      "warnings": []
    },
    {
      "candidateId": "scale-00fe9d885c-015-0698aa",
      "disposition": "accepted",
      "terminal": true,
      "intakeState": "accepted",
      "code": null,
      "detail": null,
      "failedStage": null,
      "qualityScore": 100,
      "recipeVersionId": "recver_5e75c3513a8060f141dccbee_v1",
      "warnings": []
    },
    {
      "candidateId": "scale-00fe9d885c-016-08e39f",
      "disposition": "accepted",
      "terminal": true,
      "intakeState": "accepted",
      "code": null,
      "detail": null,
      "failedStage": null,
      "qualityScore": 100,
      "recipeVersionId": "recver_66bcfab1b27e537a3b73f060_v1",
      "warnings": []
    },
    {
      "candidateId": "scale-00fe9d885c-017-e77c39",
      "disposition": "rejected",
      "terminal": true,
      "intakeState": "rejected",
      "code": "target_already_reached",
      "detail": null,
      "failedStage": "schema_provenance",
      "qualityScore": 95,
      "recipeVersionId": null,
      "warnings": []
    },
    {
      "candidateId": "scale-00fe9d885c-018-224f97",
      "disposition": "rejected",
      "terminal": true,
      "intakeState": "rejected",
      "code": "target_already_reached",
      "detail": null,
      "failedStage": "schema_provenance",
      "qualityScore": 95,
      "recipeVersionId": null,
      "warnings": []
    },
    {
      "candidateId": "scale-00fe9d885c-019-a403e2",
      "disposition": "rejected",
      "terminal": true,
      "intakeState": "rejected",
      "code": "target_already_reached",
      "detail": null,
      "failedStage": "schema_provenance",
      "qualityScore": 95,
      "recipeVersionId": null,
      "warnings": []
    },
    {
      "candidateId": "scale-00fe9d885c-020-7f539d",
      "disposition": "rejected",
      "terminal": true,
      "intakeState": "rejected",
      "code": "target_already_reached",
      "detail": null,
      "failedStage": "schema_provenance",
      "qualityScore": 95,
      "recipeVersionId": null,
      "warnings": []
    }
  ],
  "batchGate": {
    "status": "pass",
    "targetMet": true,
    "diversityPassed": true,
    "reviewBacklogCount": 0,
    "blockers": []
  },
  "resultDigest": "349a4425354c2f3b47749c071e836c0ff5efe2bfcbd9072915613c6e3e44e67f",
  "processedAt": "2026-09-07T08:09:23.165Z"
}
