{
  "schemaVersion": 1,
  "reportId": "prbr-36e38042415fe2877757",
  "policyId": "recipe-production-pipeline-v1",
  "policyVersion": "1.0.0",
  "contractId": "ydm-v1-production-corpus",
  "contractVersion": "1.0.0",
  "jobId": "batch-d43c046e1c4103",
  "intakeId": "scale-intake-ae9ae86d8044d010ddd0",
  "inputSnapshotId": "snapshot-1.0.0-production-scale-500-aab7d8b9df26",
  "referenceDataVersion": "1.0.0",
  "referenceDataDigest": "56f3949bd1c0348f8fe65861ebcda23c2a198805cd2e9f70b00610a328753b52",
  "candidateCount": 12,
  "acceptedCount": 9,
  "terminalCount": 12,
  "reviewBacklogCount": 0,
  "dispositionCounts": {
    "accepted": 9,
    "rejected": 3,
    "duplicate": 0,
    "needs_reference_review": 0,
    "needs_recipe_review": 0,
    "nutrition_outlier": 0
  },
  "candidates": [
    {
      "candidateId": "scale-ae9ae86d80-001-1c9462",
      "disposition": "accepted",
      "terminal": true,
      "intakeState": "accepted",
      "code": null,
      "detail": null,
      "failedStage": null,
      "qualityScore": 100,
      "recipeVersionId": "recver_4c31a0fa702e88b37a800fd1_v1",
      "warnings": []
    },
    {
      "candidateId": "scale-ae9ae86d80-002-e05c27",
      "disposition": "accepted",
      "terminal": true,
      "intakeState": "accepted",
      "code": null,
      "detail": null,
      "failedStage": null,
      "qualityScore": 100,
      "recipeVersionId": "recver_7c1c39429d27be9d36028fab_v1",
      "warnings": []
    },
    {
      "candidateId": "scale-ae9ae86d80-003-2530fc",
      "disposition": "accepted",
      "terminal": true,
      "intakeState": "accepted",
      "code": null,
      "detail": null,
      "failedStage": null,
      "qualityScore": 100,
      "recipeVersionId": "recver_563dbbb062746cbd74b47fff_v1",
      "warnings": []
    },
    {
      "candidateId": "scale-ae9ae86d80-004-9316cf",
      "disposition": "accepted",
      "terminal": true,
      "intakeState": "accepted",
      "code": null,
      "detail": null,
      "failedStage": null,
      "qualityScore": 100,
      "recipeVersionId": "recver_585d480edf1fda23d67755df_v1",
      "warnings": []
    },
    {
      "candidateId": "scale-ae9ae86d80-005-2c938b",
      "disposition": "accepted",
      "terminal": true,
      "intakeState": "accepted",
      "code": null,
      "detail": null,
      "failedStage": null,
      "qualityScore": 100,
      "recipeVersionId": "recver_18815a44a4688a4f04fb7e66_v1",
      "warnings": []
    },
    {
      "candidateId": "scale-ae9ae86d80-006-3a28a7",
      "disposition": "accepted",
      "terminal": true,
      "intakeState": "accepted",
      "code": null,
      "detail": null,
      "failedStage": null,
      "qualityScore": 100,
      "recipeVersionId": "recver_3ea6b946209d7ad27b324a64_v1",
      "warnings": []
    },
    {
      "candidateId": "scale-ae9ae86d80-007-7cda62",
      "disposition": "accepted",
      "terminal": true,
      "intakeState": "accepted",
      "code": null,
      "detail": null,
      "failedStage": null,
      "qualityScore": 100,
      "recipeVersionId": "recver_2068f8ccfd795126003f92ba_v1",
      "warnings": []
    },
    {
      "candidateId": "scale-ae9ae86d80-008-519cbe",
      "disposition": "accepted",
      "terminal": true,
      "intakeState": "accepted",
      "code": null,
      "detail": null,
      "failedStage": null,
      "qualityScore": 100,
      "recipeVersionId": "recver_a019439a95ffce9d639c7688_v1",
      "warnings": []
    },
    {
      "candidateId": "scale-ae9ae86d80-009-e7f39d",
      "disposition": "accepted",
      "terminal": true,
      "intakeState": "accepted",
      "code": null,
      "detail": null,
      "failedStage": null,
      "qualityScore": 100,
      "recipeVersionId": "recver_457c0f3612a6d3ff66353ceb_v1",
      "warnings": []
    },
    {
      "candidateId": "scale-ae9ae86d80-010-a641ee",
      "disposition": "rejected",
      "terminal": true,
      "intakeState": "rejected",
      "code": "target_already_reached",
      "detail": null,
      "failedStage": "schema_provenance",
      "qualityScore": 95,
      "recipeVersionId": null,
      "warnings": []
    },
    {
      "candidateId": "scale-ae9ae86d80-011-c51403",
      "disposition": "rejected",
      "terminal": true,
      "intakeState": "rejected",
      "code": "target_already_reached",
      "detail": null,
      "failedStage": "schema_provenance",
      "qualityScore": 95,
      "recipeVersionId": null,
      "warnings": []
    },
    {
      "candidateId": "scale-ae9ae86d80-012-fbf051",
      "disposition": "rejected",
      "terminal": true,
      "intakeState": "rejected",
      "code": "target_already_reached",
      "detail": null,
      "failedStage": "schema_provenance",
      "qualityScore": 95,
      "recipeVersionId": null,
      "warnings": []
    }
  ],
  "batchGate": {
    "status": "pass",
    "targetMet": true,
    "diversityPassed": true,
    "reviewBacklogCount": 0,
    "blockers": []
  },
  "resultDigest": "36e38042415fe28777578e53570b545bed9be8859c32c95e414a8ce2f587e446",
  "processedAt": "2026-09-07T08:09:27.494Z"
}
