{
  "schemaVersion": 1,
  "reportId": "prbr-f893db3c7a057f800b76",
  "policyId": "recipe-production-pipeline-v1",
  "policyVersion": "1.0.0",
  "contractId": "ydm-v1-production-corpus",
  "contractVersion": "1.0.0",
  "jobId": "batch-da4c717582fcc4",
  "intakeId": "scale-intake-b691f1d4b50c5b22a700",
  "inputSnapshotId": "snapshot-1.0.0-production-scale-500-f17fdc76757f",
  "referenceDataVersion": "1.0.0",
  "referenceDataDigest": "56f3949bd1c0348f8fe65861ebcda23c2a198805cd2e9f70b00610a328753b52",
  "candidateCount": 13,
  "acceptedCount": 10,
  "terminalCount": 13,
  "reviewBacklogCount": 0,
  "dispositionCounts": {
    "accepted": 10,
    "rejected": 3,
    "duplicate": 0,
    "needs_reference_review": 0,
    "needs_recipe_review": 0,
    "nutrition_outlier": 0
  },
  "candidates": [
    {
      "candidateId": "scale-b691f1d4b5-001-d2e17b",
      "disposition": "accepted",
      "terminal": true,
      "intakeState": "accepted",
      "code": null,
      "detail": null,
      "failedStage": null,
      "qualityScore": 100,
      "recipeVersionId": "recver_748d7c1375aecb4b068f8b46_v1",
      "warnings": []
    },
    {
      "candidateId": "scale-b691f1d4b5-002-65acdb",
      "disposition": "accepted",
      "terminal": true,
      "intakeState": "accepted",
      "code": null,
      "detail": null,
      "failedStage": null,
      "qualityScore": 100,
      "recipeVersionId": "recver_69511b33bdb132de28abfdaa_v1",
      "warnings": []
    },
    {
      "candidateId": "scale-b691f1d4b5-003-1fedf7",
      "disposition": "accepted",
      "terminal": true,
      "intakeState": "accepted",
      "code": null,
      "detail": null,
      "failedStage": null,
      "qualityScore": 100,
      "recipeVersionId": "recver_60a73e3094bf5e5fb7621c4f_v1",
      "warnings": []
    },
    {
      "candidateId": "scale-b691f1d4b5-004-afdd45",
      "disposition": "accepted",
      "terminal": true,
      "intakeState": "accepted",
      "code": null,
      "detail": null,
      "failedStage": null,
      "qualityScore": 100,
      "recipeVersionId": "recver_628c980c9a507942c69ba399_v1",
      "warnings": []
    },
    {
      "candidateId": "scale-b691f1d4b5-005-6f9a44",
      "disposition": "accepted",
      "terminal": true,
      "intakeState": "accepted",
      "code": null,
      "detail": null,
      "failedStage": null,
      "qualityScore": 100,
      "recipeVersionId": "recver_d019b6cf2c3d1021c317247c_v1",
      "warnings": []
    },
    {
      "candidateId": "scale-b691f1d4b5-006-a302d5",
      "disposition": "accepted",
      "terminal": true,
      "intakeState": "accepted",
      "code": null,
      "detail": null,
      "failedStage": null,
      "qualityScore": 100,
      "recipeVersionId": "recver_016987540ec8a9e64f0c5af0_v1",
      "warnings": []
    },
    {
      "candidateId": "scale-b691f1d4b5-007-8d27dd",
      "disposition": "accepted",
      "terminal": true,
      "intakeState": "accepted",
      "code": null,
      "detail": null,
      "failedStage": null,
      "qualityScore": 100,
      "recipeVersionId": "recver_77d8034d4050db969a852653_v1",
      "warnings": []
    },
    {
      "candidateId": "scale-b691f1d4b5-008-2ae60c",
      "disposition": "accepted",
      "terminal": true,
      "intakeState": "accepted",
      "code": null,
      "detail": null,
      "failedStage": null,
      "qualityScore": 100,
      "recipeVersionId": "recver_92b12714ae153bb8922b052b_v1",
      "warnings": []
    },
    {
      "candidateId": "scale-b691f1d4b5-009-f08ae9",
      "disposition": "accepted",
      "terminal": true,
      "intakeState": "accepted",
      "code": null,
      "detail": null,
      "failedStage": null,
      "qualityScore": 100,
      "recipeVersionId": "recver_34262ceb0f5c1890d9df8f71_v1",
      "warnings": []
    },
    {
      "candidateId": "scale-b691f1d4b5-010-735d4f",
      "disposition": "accepted",
      "terminal": true,
      "intakeState": "accepted",
      "code": null,
      "detail": null,
      "failedStage": null,
      "qualityScore": 100,
      "recipeVersionId": "recver_d4a4a0b94f5ed35e387ad4a2_v1",
      "warnings": []
    },
    {
      "candidateId": "scale-b691f1d4b5-011-552613",
      "disposition": "rejected",
      "terminal": true,
      "intakeState": "rejected",
      "code": "target_already_reached",
      "detail": null,
      "failedStage": "schema_provenance",
      "qualityScore": 95,
      "recipeVersionId": null,
      "warnings": []
    },
    {
      "candidateId": "scale-b691f1d4b5-012-9fcd90",
      "disposition": "rejected",
      "terminal": true,
      "intakeState": "rejected",
      "code": "target_already_reached",
      "detail": null,
      "failedStage": "schema_provenance",
      "qualityScore": 95,
      "recipeVersionId": null,
      "warnings": []
    },
    {
      "candidateId": "scale-b691f1d4b5-013-d5dcd8",
      "disposition": "rejected",
      "terminal": true,
      "intakeState": "rejected",
      "code": "target_already_reached",
      "detail": null,
      "failedStage": "schema_provenance",
      "qualityScore": 95,
      "recipeVersionId": null,
      "warnings": []
    }
  ],
  "batchGate": {
    "status": "pass",
    "targetMet": true,
    "diversityPassed": true,
    "reviewBacklogCount": 0,
    "blockers": []
  },
  "resultDigest": "f893db3c7a057f800b76082c5f77448358b1e04ae99cf2451bf4023f0d5ef6f3",
  "processedAt": "2026-09-07T08:09:42.835Z"
}
