{
  "schemaVersion": 1,
  "reportId": "prbr-1eea28d4ea8983f8846d",
  "policyId": "recipe-production-pipeline-v1",
  "policyVersion": "1.0.0",
  "contractId": "ydm-v1-production-corpus",
  "contractVersion": "1.0.0",
  "jobId": "batch-cd40e54c10746d",
  "intakeId": "scale-intake-15c9a7b3fb3481a6d738",
  "inputSnapshotId": "snapshot-1.0.0-production-scale-500-1a2702682578",
  "referenceDataVersion": "1.0.0",
  "referenceDataDigest": "56f3949bd1c0348f8fe65861ebcda23c2a198805cd2e9f70b00610a328753b52",
  "candidateCount": 13,
  "acceptedCount": 10,
  "terminalCount": 13,
  "reviewBacklogCount": 0,
  "dispositionCounts": {
    "accepted": 10,
    "rejected": 3,
    "duplicate": 0,
    "needs_reference_review": 0,
    "needs_recipe_review": 0,
    "nutrition_outlier": 0
  },
  "candidates": [
    {
      "candidateId": "scale-15c9a7b3fb-001-d69d73",
      "disposition": "accepted",
      "terminal": true,
      "intakeState": "accepted",
      "code": null,
      "detail": null,
      "failedStage": null,
      "qualityScore": 100,
      "recipeVersionId": "recver_1080622042478190bb4c2c37_v1",
      "warnings": []
    },
    {
      "candidateId": "scale-15c9a7b3fb-002-c3bc68",
      "disposition": "accepted",
      "terminal": true,
      "intakeState": "accepted",
      "code": null,
      "detail": null,
      "failedStage": null,
      "qualityScore": 100,
      "recipeVersionId": "recver_e0c0475188646fb90fe1d5e6_v1",
      "warnings": []
    },
    {
      "candidateId": "scale-15c9a7b3fb-003-4dc45d",
      "disposition": "accepted",
      "terminal": true,
      "intakeState": "accepted",
      "code": null,
      "detail": null,
      "failedStage": null,
      "qualityScore": 100,
      "recipeVersionId": "recver_e180e4d02d977d9a4e0b573b_v1",
      "warnings": []
    },
    {
      "candidateId": "scale-15c9a7b3fb-004-a8e3db",
      "disposition": "accepted",
      "terminal": true,
      "intakeState": "accepted",
      "code": null,
      "detail": null,
      "failedStage": null,
      "qualityScore": 100,
      "recipeVersionId": "recver_4c838ef803890a09ddc5ac97_v1",
      "warnings": []
    },
    {
      "candidateId": "scale-15c9a7b3fb-005-4f13ea",
      "disposition": "accepted",
      "terminal": true,
      "intakeState": "accepted",
      "code": null,
      "detail": null,
      "failedStage": null,
      "qualityScore": 100,
      "recipeVersionId": "recver_8e7331cf788d52a61ed1495e_v1",
      "warnings": []
    },
    {
      "candidateId": "scale-15c9a7b3fb-006-ea0675",
      "disposition": "accepted",
      "terminal": true,
      "intakeState": "accepted",
      "code": null,
      "detail": null,
      "failedStage": null,
      "qualityScore": 100,
      "recipeVersionId": "recver_fd12d2d94196437266bdc55f_v1",
      "warnings": []
    },
    {
      "candidateId": "scale-15c9a7b3fb-007-bcd14e",
      "disposition": "accepted",
      "terminal": true,
      "intakeState": "accepted",
      "code": null,
      "detail": null,
      "failedStage": null,
      "qualityScore": 100,
      "recipeVersionId": "recver_3b987dea178d0ad0546ec919_v1",
      "warnings": []
    },
    {
      "candidateId": "scale-15c9a7b3fb-008-129823",
      "disposition": "accepted",
      "terminal": true,
      "intakeState": "accepted",
      "code": null,
      "detail": null,
      "failedStage": null,
      "qualityScore": 100,
      "recipeVersionId": "recver_1a3eca942041cc35a8835876_v1",
      "warnings": []
    },
    {
      "candidateId": "scale-15c9a7b3fb-009-8cee74",
      "disposition": "accepted",
      "terminal": true,
      "intakeState": "accepted",
      "code": null,
      "detail": null,
      "failedStage": null,
      "qualityScore": 100,
      "recipeVersionId": "recver_dbdf6a7f76eb5eaad9fe0365_v1",
      "warnings": []
    },
    {
      "candidateId": "scale-15c9a7b3fb-010-ac80b2",
      "disposition": "accepted",
      "terminal": true,
      "intakeState": "accepted",
      "code": null,
      "detail": null,
      "failedStage": null,
      "qualityScore": 100,
      "recipeVersionId": "recver_f4c1f1ecdebf82cd31bcc926_v1",
      "warnings": []
    },
    {
      "candidateId": "scale-15c9a7b3fb-011-573a18",
      "disposition": "rejected",
      "terminal": true,
      "intakeState": "rejected",
      "code": "target_already_reached",
      "detail": null,
      "failedStage": "schema_provenance",
      "qualityScore": 95,
      "recipeVersionId": null,
      "warnings": []
    },
    {
      "candidateId": "scale-15c9a7b3fb-012-22f647",
      "disposition": "rejected",
      "terminal": true,
      "intakeState": "rejected",
      "code": "target_already_reached",
      "detail": null,
      "failedStage": "schema_provenance",
      "qualityScore": 95,
      "recipeVersionId": null,
      "warnings": []
    },
    {
      "candidateId": "scale-15c9a7b3fb-013-8a1e7b",
      "disposition": "rejected",
      "terminal": true,
      "intakeState": "rejected",
      "code": "target_already_reached",
      "detail": null,
      "failedStage": "schema_provenance",
      "qualityScore": 95,
      "recipeVersionId": null,
      "warnings": []
    }
  ],
  "batchGate": {
    "status": "pass",
    "targetMet": true,
    "diversityPassed": true,
    "reviewBacklogCount": 0,
    "blockers": []
  },
  "resultDigest": "1eea28d4ea8983f8846dc4941a50a278ed5c960e33d1b49cd48c319effe65d94",
  "processedAt": "2026-09-07T08:09:39.452Z"
}
