{
  "schemaVersion": 1,
  "reportId": "prbr-77419d0f95adda9c0c9c",
  "policyId": "recipe-production-pipeline-v1",
  "policyVersion": "1.0.0",
  "contractId": "ydm-v1-production-corpus",
  "contractVersion": "1.0.0",
  "jobId": "batch-7374ea41a57599",
  "intakeId": "scale-intake-13d17d24f69a35b9b018",
  "inputSnapshotId": "snapshot-1.0.0-production-scale-500-977aebd4d058",
  "referenceDataVersion": "1.0.0",
  "referenceDataDigest": "56f3949bd1c0348f8fe65861ebcda23c2a198805cd2e9f70b00610a328753b52",
  "candidateCount": 13,
  "acceptedCount": 10,
  "terminalCount": 13,
  "reviewBacklogCount": 0,
  "dispositionCounts": {
    "accepted": 10,
    "rejected": 3,
    "duplicate": 0,
    "needs_reference_review": 0,
    "needs_recipe_review": 0,
    "nutrition_outlier": 0
  },
  "candidates": [
    {
      "candidateId": "scale-13d17d24f6-001-4e1f9d",
      "disposition": "accepted",
      "terminal": true,
      "intakeState": "accepted",
      "code": null,
      "detail": null,
      "failedStage": null,
      "qualityScore": 100,
      "recipeVersionId": "recver_3d42c172cf0daf8561226136_v1",
      "warnings": []
    },
    {
      "candidateId": "scale-13d17d24f6-002-591f44",
      "disposition": "accepted",
      "terminal": true,
      "intakeState": "accepted",
      "code": null,
      "detail": null,
      "failedStage": null,
      "qualityScore": 100,
      "recipeVersionId": "recver_b49554db467e698b4f59fd06_v1",
      "warnings": []
    },
    {
      "candidateId": "scale-13d17d24f6-003-bdfec0",
      "disposition": "accepted",
      "terminal": true,
      "intakeState": "accepted",
      "code": null,
      "detail": null,
      "failedStage": null,
      "qualityScore": 100,
      "recipeVersionId": "recver_97fc53f497e862a76d6b77c5_v1",
      "warnings": []
    },
    {
      "candidateId": "scale-13d17d24f6-004-93097b",
      "disposition": "accepted",
      "terminal": true,
      "intakeState": "accepted",
      "code": null,
      "detail": null,
      "failedStage": null,
      "qualityScore": 100,
      "recipeVersionId": "recver_0ca0bd09e9a36db583b25807_v1",
      "warnings": []
    },
    {
      "candidateId": "scale-13d17d24f6-005-f3e289",
      "disposition": "accepted",
      "terminal": true,
      "intakeState": "accepted",
      "code": null,
      "detail": null,
      "failedStage": null,
      "qualityScore": 100,
      "recipeVersionId": "recver_e144ea3f07a7f11fc06d5b1d_v1",
      "warnings": []
    },
    {
      "candidateId": "scale-13d17d24f6-006-636218",
      "disposition": "accepted",
      "terminal": true,
      "intakeState": "accepted",
      "code": null,
      "detail": null,
      "failedStage": null,
      "qualityScore": 100,
      "recipeVersionId": "recver_49f2a15012d658d0b5ffe6c3_v1",
      "warnings": []
    },
    {
      "candidateId": "scale-13d17d24f6-007-418ae6",
      "disposition": "rejected",
      "terminal": true,
      "intakeState": "rejected",
      "code": "diversity_primary_frequency",
      "detail": "ing_fdc_170893",
      "failedStage": "duplicate_diversity",
      "qualityScore": 85,
      "recipeVersionId": null,
      "warnings": []
    },
    {
      "candidateId": "scale-13d17d24f6-008-1ceaf5",
      "disposition": "accepted",
      "terminal": true,
      "intakeState": "accepted",
      "code": null,
      "detail": null,
      "failedStage": null,
      "qualityScore": 100,
      "recipeVersionId": "recver_7790d337f33555edd622d3cd_v1",
      "warnings": []
    },
    {
      "candidateId": "scale-13d17d24f6-009-d7adb8",
      "disposition": "accepted",
      "terminal": true,
      "intakeState": "accepted",
      "code": null,
      "detail": null,
      "failedStage": null,
      "qualityScore": 100,
      "recipeVersionId": "recver_71d1ae112bb572e2175bb2cf_v1",
      "warnings": []
    },
    {
      "candidateId": "scale-13d17d24f6-010-ba264c",
      "disposition": "rejected",
      "terminal": true,
      "intakeState": "rejected",
      "code": "diversity_primary_frequency",
      "detail": "ing_fdc_170893",
      "failedStage": "duplicate_diversity",
      "qualityScore": 85,
      "recipeVersionId": null,
      "warnings": []
    },
    {
      "candidateId": "scale-13d17d24f6-011-442e27",
      "disposition": "accepted",
      "terminal": true,
      "intakeState": "accepted",
      "code": null,
      "detail": null,
      "failedStage": null,
      "qualityScore": 100,
      "recipeVersionId": "recver_595f3f5018f54d4888936342_v1",
      "warnings": []
    },
    {
      "candidateId": "scale-13d17d24f6-012-2a1605",
      "disposition": "accepted",
      "terminal": true,
      "intakeState": "accepted",
      "code": null,
      "detail": null,
      "failedStage": null,
      "qualityScore": 100,
      "recipeVersionId": "recver_71f123725cfaa7244c9f83b5_v1",
      "warnings": []
    },
    {
      "candidateId": "scale-13d17d24f6-013-fe69ce",
      "disposition": "rejected",
      "terminal": true,
      "intakeState": "rejected",
      "code": "target_already_reached",
      "detail": null,
      "failedStage": "schema_provenance",
      "qualityScore": 95,
      "recipeVersionId": null,
      "warnings": []
    }
  ],
  "batchGate": {
    "status": "pass",
    "targetMet": true,
    "diversityPassed": true,
    "reviewBacklogCount": 0,
    "blockers": []
  },
  "resultDigest": "77419d0f95adda9c0c9ca4d8580b428dced6ec43050f17b89477c0dab927c50f",
  "processedAt": "2026-09-07T08:10:05.869Z"
}
