{
  "schemaVersion": 1,
  "reportId": "prbr-09fbaf28d7549e83ac7d",
  "policyId": "recipe-production-pipeline-v1",
  "policyVersion": "1.0.0",
  "contractId": "ydm-v1-production-corpus",
  "contractVersion": "1.0.0",
  "jobId": "batch-d024c40fc8ea32",
  "intakeId": "scale-intake-6031c69de552cd33be9a",
  "inputSnapshotId": "snapshot-1.0.0-production-scale-500-f2d09f5b5117",
  "referenceDataVersion": "1.0.0",
  "referenceDataDigest": "56f3949bd1c0348f8fe65861ebcda23c2a198805cd2e9f70b00610a328753b52",
  "candidateCount": 13,
  "acceptedCount": 10,
  "terminalCount": 13,
  "reviewBacklogCount": 0,
  "dispositionCounts": {
    "accepted": 10,
    "rejected": 3,
    "duplicate": 0,
    "needs_reference_review": 0,
    "needs_recipe_review": 0,
    "nutrition_outlier": 0
  },
  "candidates": [
    {
      "candidateId": "scale-6031c69de5-001-87c69c",
      "disposition": "accepted",
      "terminal": true,
      "intakeState": "accepted",
      "code": null,
      "detail": null,
      "failedStage": null,
      "qualityScore": 100,
      "recipeVersionId": "recver_378e4cd5d658bce8e78768a0_v1",
      "warnings": []
    },
    {
      "candidateId": "scale-6031c69de5-002-3c271e",
      "disposition": "accepted",
      "terminal": true,
      "intakeState": "accepted",
      "code": null,
      "detail": null,
      "failedStage": null,
      "qualityScore": 100,
      "recipeVersionId": "recver_c8870474f4c7d1fb0d4fe380_v1",
      "warnings": []
    },
    {
      "candidateId": "scale-6031c69de5-003-71ff84",
      "disposition": "accepted",
      "terminal": true,
      "intakeState": "accepted",
      "code": null,
      "detail": null,
      "failedStage": null,
      "qualityScore": 100,
      "recipeVersionId": "recver_c58abb59652557d670ae7d27_v1",
      "warnings": []
    },
    {
      "candidateId": "scale-6031c69de5-004-59331a",
      "disposition": "accepted",
      "terminal": true,
      "intakeState": "accepted",
      "code": null,
      "detail": null,
      "failedStage": null,
      "qualityScore": 100,
      "recipeVersionId": "recver_021d561fbc72f45e818d96ec_v1",
      "warnings": []
    },
    {
      "candidateId": "scale-6031c69de5-005-305a40",
      "disposition": "accepted",
      "terminal": true,
      "intakeState": "accepted",
      "code": null,
      "detail": null,
      "failedStage": null,
      "qualityScore": 100,
      "recipeVersionId": "recver_57dfbc0cfd092d51e0e495a0_v1",
      "warnings": []
    },
    {
      "candidateId": "scale-6031c69de5-006-de1716",
      "disposition": "accepted",
      "terminal": true,
      "intakeState": "accepted",
      "code": null,
      "detail": null,
      "failedStage": null,
      "qualityScore": 100,
      "recipeVersionId": "recver_5e17ff78f7e090c404e96dd5_v1",
      "warnings": []
    },
    {
      "candidateId": "scale-6031c69de5-007-98da68",
      "disposition": "accepted",
      "terminal": true,
      "intakeState": "accepted",
      "code": null,
      "detail": null,
      "failedStage": null,
      "qualityScore": 100,
      "recipeVersionId": "recver_5d983b5d45d19ec6f38d3920_v1",
      "warnings": []
    },
    {
      "candidateId": "scale-6031c69de5-008-0bfea8",
      "disposition": "accepted",
      "terminal": true,
      "intakeState": "accepted",
      "code": null,
      "detail": null,
      "failedStage": null,
      "qualityScore": 100,
      "recipeVersionId": "recver_0016e6ab0ea31842c44f8f54_v1",
      "warnings": []
    },
    {
      "candidateId": "scale-6031c69de5-009-009dd0",
      "disposition": "accepted",
      "terminal": true,
      "intakeState": "accepted",
      "code": null,
      "detail": null,
      "failedStage": null,
      "qualityScore": 100,
      "recipeVersionId": "recver_b26a2c15372229c0f1527394_v1",
      "warnings": []
    },
    {
      "candidateId": "scale-6031c69de5-010-1f1e3a",
      "disposition": "accepted",
      "terminal": true,
      "intakeState": "accepted",
      "code": null,
      "detail": null,
      "failedStage": null,
      "qualityScore": 100,
      "recipeVersionId": "recver_63df38743d635bfc9508ec6d_v1",
      "warnings": []
    },
    {
      "candidateId": "scale-6031c69de5-011-46547d",
      "disposition": "rejected",
      "terminal": true,
      "intakeState": "rejected",
      "code": "target_already_reached",
      "detail": null,
      "failedStage": "schema_provenance",
      "qualityScore": 95,
      "recipeVersionId": null,
      "warnings": []
    },
    {
      "candidateId": "scale-6031c69de5-012-661873",
      "disposition": "rejected",
      "terminal": true,
      "intakeState": "rejected",
      "code": "target_already_reached",
      "detail": null,
      "failedStage": "schema_provenance",
      "qualityScore": 95,
      "recipeVersionId": null,
      "warnings": []
    },
    {
      "candidateId": "scale-6031c69de5-013-8ab3c6",
      "disposition": "rejected",
      "terminal": true,
      "intakeState": "rejected",
      "code": "target_already_reached",
      "detail": null,
      "failedStage": "schema_provenance",
      "qualityScore": 95,
      "recipeVersionId": null,
      "warnings": []
    }
  ],
  "batchGate": {
    "status": "pass",
    "targetMet": true,
    "diversityPassed": true,
    "reviewBacklogCount": 0,
    "blockers": []
  },
  "resultDigest": "09fbaf28d7549e83ac7d35c406762f917a2de5e22904e0907ec22aed006d9647",
  "processedAt": "2026-09-07T08:09:53.094Z"
}
