{
  "schemaVersion": 1,
  "reportId": "prbr-9b4fce2dfea954df73b4",
  "policyId": "recipe-production-pipeline-v1",
  "policyVersion": "1.0.0",
  "contractId": "ydm-v1-production-corpus",
  "contractVersion": "1.0.0",
  "jobId": "batch-518241b7362158",
  "intakeId": "scale-intake-063da69f35436f94b7e5",
  "inputSnapshotId": "snapshot-1.0.0-production-scale-500-40b3fff14d5d",
  "referenceDataVersion": "1.0.0",
  "referenceDataDigest": "56f3949bd1c0348f8fe65861ebcda23c2a198805cd2e9f70b00610a328753b52",
  "candidateCount": 13,
  "acceptedCount": 10,
  "terminalCount": 13,
  "reviewBacklogCount": 0,
  "dispositionCounts": {
    "accepted": 10,
    "rejected": 3,
    "duplicate": 0,
    "needs_reference_review": 0,
    "needs_recipe_review": 0,
    "nutrition_outlier": 0
  },
  "candidates": [
    {
      "candidateId": "scale-063da69f35-001-e01ee6",
      "disposition": "accepted",
      "terminal": true,
      "intakeState": "accepted",
      "code": null,
      "detail": null,
      "failedStage": null,
      "qualityScore": 100,
      "recipeVersionId": "recver_9b3de54eb36d3e1c05eaab4d_v1",
      "warnings": []
    },
    {
      "candidateId": "scale-063da69f35-002-d643b8",
      "disposition": "accepted",
      "terminal": true,
      "intakeState": "accepted",
      "code": null,
      "detail": null,
      "failedStage": null,
      "qualityScore": 100,
      "recipeVersionId": "recver_13379c7982aaf159fce3ee9a_v1",
      "warnings": []
    },
    {
      "candidateId": "scale-063da69f35-003-0ad41c",
      "disposition": "accepted",
      "terminal": true,
      "intakeState": "accepted",
      "code": null,
      "detail": null,
      "failedStage": null,
      "qualityScore": 100,
      "recipeVersionId": "recver_270c7c75bba3e100b6c7d5f1_v1",
      "warnings": []
    },
    {
      "candidateId": "scale-063da69f35-004-65b06e",
      "disposition": "accepted",
      "terminal": true,
      "intakeState": "accepted",
      "code": null,
      "detail": null,
      "failedStage": null,
      "qualityScore": 100,
      "recipeVersionId": "recver_66623f0b69ab4750c659ea8d_v1",
      "warnings": []
    },
    {
      "candidateId": "scale-063da69f35-005-56a1d2",
      "disposition": "accepted",
      "terminal": true,
      "intakeState": "accepted",
      "code": null,
      "detail": null,
      "failedStage": null,
      "qualityScore": 100,
      "recipeVersionId": "recver_57ddee88d9ce17e13d59c4f0_v1",
      "warnings": []
    },
    {
      "candidateId": "scale-063da69f35-006-344922",
      "disposition": "accepted",
      "terminal": true,
      "intakeState": "accepted",
      "code": null,
      "detail": null,
      "failedStage": null,
      "qualityScore": 100,
      "recipeVersionId": "recver_dc845f4c0c05e5e29d414a5b_v1",
      "warnings": []
    },
    {
      "candidateId": "scale-063da69f35-007-4f557b",
      "disposition": "accepted",
      "terminal": true,
      "intakeState": "accepted",
      "code": null,
      "detail": null,
      "failedStage": null,
      "qualityScore": 100,
      "recipeVersionId": "recver_5240c406c1de066b42448776_v1",
      "warnings": []
    },
    {
      "candidateId": "scale-063da69f35-008-e16e3e",
      "disposition": "accepted",
      "terminal": true,
      "intakeState": "accepted",
      "code": null,
      "detail": null,
      "failedStage": null,
      "qualityScore": 100,
      "recipeVersionId": "recver_85bd03065e117237ee33acda_v1",
      "warnings": []
    },
    {
      "candidateId": "scale-063da69f35-009-b2056f",
      "disposition": "accepted",
      "terminal": true,
      "intakeState": "accepted",
      "code": null,
      "detail": null,
      "failedStage": null,
      "qualityScore": 100,
      "recipeVersionId": "recver_bbd3dd16d8a203ee879d6b38_v1",
      "warnings": []
    },
    {
      "candidateId": "scale-063da69f35-010-810ea6",
      "disposition": "accepted",
      "terminal": true,
      "intakeState": "accepted",
      "code": null,
      "detail": null,
      "failedStage": null,
      "qualityScore": 100,
      "recipeVersionId": "recver_f759b3b3812eb2f6d9800cb6_v1",
      "warnings": []
    },
    {
      "candidateId": "scale-063da69f35-011-26c511",
      "disposition": "rejected",
      "terminal": true,
      "intakeState": "rejected",
      "code": "target_already_reached",
      "detail": null,
      "failedStage": "schema_provenance",
      "qualityScore": 95,
      "recipeVersionId": null,
      "warnings": []
    },
    {
      "candidateId": "scale-063da69f35-012-82c6d2",
      "disposition": "rejected",
      "terminal": true,
      "intakeState": "rejected",
      "code": "target_already_reached",
      "detail": null,
      "failedStage": "schema_provenance",
      "qualityScore": 95,
      "recipeVersionId": null,
      "warnings": []
    },
    {
      "candidateId": "scale-063da69f35-013-9a9ae5",
      "disposition": "rejected",
      "terminal": true,
      "intakeState": "rejected",
      "code": "target_already_reached",
      "detail": null,
      "failedStage": "schema_provenance",
      "qualityScore": 95,
      "recipeVersionId": null,
      "warnings": []
    }
  ],
  "batchGate": {
    "status": "pass",
    "targetMet": true,
    "diversityPassed": true,
    "reviewBacklogCount": 0,
    "blockers": []
  },
  "resultDigest": "9b4fce2dfea954df73b49a7f5e91e5ebbcc36aa2a0313c2a7fe9a37f31c5646c",
  "processedAt": "2026-09-07T08:10:08.530Z"
}
