{
  "schemaVersion": 1,
  "reportId": "prbr-cb6c3cc6700666d8e969",
  "policyId": "recipe-production-pipeline-v1",
  "policyVersion": "1.0.0",
  "contractId": "ydm-v1-production-corpus",
  "contractVersion": "1.0.0",
  "jobId": "batch-4078b29bd18885",
  "intakeId": "scale-intake-c9590c9e4f094004ed1e",
  "inputSnapshotId": "snapshot-1.0.0-production-scale-500-d79465881c80",
  "referenceDataVersion": "1.0.0",
  "referenceDataDigest": "56f3949bd1c0348f8fe65861ebcda23c2a198805cd2e9f70b00610a328753b52",
  "candidateCount": 12,
  "acceptedCount": 9,
  "terminalCount": 12,
  "reviewBacklogCount": 0,
  "dispositionCounts": {
    "accepted": 9,
    "rejected": 3,
    "duplicate": 0,
    "needs_reference_review": 0,
    "needs_recipe_review": 0,
    "nutrition_outlier": 0
  },
  "candidates": [
    {
      "candidateId": "scale-c9590c9e4f-001-91b333",
      "disposition": "accepted",
      "terminal": true,
      "intakeState": "accepted",
      "code": null,
      "detail": null,
      "failedStage": null,
      "qualityScore": 100,
      "recipeVersionId": "recver_46c379981c61eb41e5739b98_v1",
      "warnings": []
    },
    {
      "candidateId": "scale-c9590c9e4f-002-ca4094",
      "disposition": "accepted",
      "terminal": true,
      "intakeState": "accepted",
      "code": null,
      "detail": null,
      "failedStage": null,
      "qualityScore": 100,
      "recipeVersionId": "recver_0a56f99653a6716b2d37f7a0_v1",
      "warnings": []
    },
    {
      "candidateId": "scale-c9590c9e4f-003-eff350",
      "disposition": "accepted",
      "terminal": true,
      "intakeState": "accepted",
      "code": null,
      "detail": null,
      "failedStage": null,
      "qualityScore": 100,
      "recipeVersionId": "recver_fabffc933158ceb127998f4b_v1",
      "warnings": []
    },
    {
      "candidateId": "scale-c9590c9e4f-004-4bf579",
      "disposition": "accepted",
      "terminal": true,
      "intakeState": "accepted",
      "code": null,
      "detail": null,
      "failedStage": null,
      "qualityScore": 100,
      "recipeVersionId": "recver_49f3b3efb2a81ad46091a66e_v1",
      "warnings": []
    },
    {
      "candidateId": "scale-c9590c9e4f-005-9550fa",
      "disposition": "accepted",
      "terminal": true,
      "intakeState": "accepted",
      "code": null,
      "detail": null,
      "failedStage": null,
      "qualityScore": 100,
      "recipeVersionId": "recver_f0b11948698472bc7b510b6e_v1",
      "warnings": []
    },
    {
      "candidateId": "scale-c9590c9e4f-006-e56f14",
      "disposition": "accepted",
      "terminal": true,
      "intakeState": "accepted",
      "code": null,
      "detail": null,
      "failedStage": null,
      "qualityScore": 100,
      "recipeVersionId": "recver_c33338d1fbec2310756914c3_v1",
      "warnings": []
    },
    {
      "candidateId": "scale-c9590c9e4f-007-e6ff68",
      "disposition": "accepted",
      "terminal": true,
      "intakeState": "accepted",
      "code": null,
      "detail": null,
      "failedStage": null,
      "qualityScore": 100,
      "recipeVersionId": "recver_cbbd501fd208c6be95cf644a_v1",
      "warnings": []
    },
    {
      "candidateId": "scale-c9590c9e4f-008-ea828b",
      "disposition": "accepted",
      "terminal": true,
      "intakeState": "accepted",
      "code": null,
      "detail": null,
      "failedStage": null,
      "qualityScore": 100,
      "recipeVersionId": "recver_3ba3edd23e3c39c5cdbb6be5_v1",
      "warnings": []
    },
    {
      "candidateId": "scale-c9590c9e4f-009-64b6db",
      "disposition": "accepted",
      "terminal": true,
      "intakeState": "accepted",
      "code": null,
      "detail": null,
      "failedStage": null,
      "qualityScore": 100,
      "recipeVersionId": "recver_dc6978b873526e3926204db1_v1",
      "warnings": []
    },
    {
      "candidateId": "scale-c9590c9e4f-010-d4aab4",
      "disposition": "rejected",
      "terminal": true,
      "intakeState": "rejected",
      "code": "target_already_reached",
      "detail": null,
      "failedStage": "schema_provenance",
      "qualityScore": 95,
      "recipeVersionId": null,
      "warnings": []
    },
    {
      "candidateId": "scale-c9590c9e4f-011-ce5c0d",
      "disposition": "rejected",
      "terminal": true,
      "intakeState": "rejected",
      "code": "target_already_reached",
      "detail": null,
      "failedStage": "schema_provenance",
      "qualityScore": 95,
      "recipeVersionId": null,
      "warnings": []
    },
    {
      "candidateId": "scale-c9590c9e4f-012-45e414",
      "disposition": "rejected",
      "terminal": true,
      "intakeState": "rejected",
      "code": "target_already_reached",
      "detail": null,
      "failedStage": "schema_provenance",
      "qualityScore": 95,
      "recipeVersionId": null,
      "warnings": []
    }
  ],
  "batchGate": {
    "status": "pass",
    "targetMet": true,
    "diversityPassed": true,
    "reviewBacklogCount": 0,
    "blockers": []
  },
  "resultDigest": "cb6c3cc6700666d8e9699c328d03790a84c21b1b54bf259fcd85f765d577ae76",
  "processedAt": "2026-09-07T08:09:31.506Z"
}
