{
  "schemaVersion": 1,
  "reportId": "prbr-9b7c136d2a17ccd44c3d",
  "policyId": "recipe-production-pipeline-v1",
  "policyVersion": "1.0.0",
  "contractId": "ydm-v1-production-corpus",
  "contractVersion": "1.0.0",
  "jobId": "batch-6797c479930498",
  "intakeId": "scale-intake-7ec23f799c0a1ff3561a",
  "inputSnapshotId": "snapshot-1.0.0-production-scale-500-29a841ba1734",
  "referenceDataVersion": "1.0.0",
  "referenceDataDigest": "56f3949bd1c0348f8fe65861ebcda23c2a198805cd2e9f70b00610a328753b52",
  "candidateCount": 13,
  "acceptedCount": 10,
  "terminalCount": 13,
  "reviewBacklogCount": 0,
  "dispositionCounts": {
    "accepted": 10,
    "rejected": 3,
    "duplicate": 0,
    "needs_reference_review": 0,
    "needs_recipe_review": 0,
    "nutrition_outlier": 0
  },
  "candidates": [
    {
      "candidateId": "scale-7ec23f799c-001-7084f6",
      "disposition": "accepted",
      "terminal": true,
      "intakeState": "accepted",
      "code": null,
      "detail": null,
      "failedStage": null,
      "qualityScore": 100,
      "recipeVersionId": "recver_b85dbc880268533e68b70ca5_v1",
      "warnings": []
    },
    {
      "candidateId": "scale-7ec23f799c-002-972759",
      "disposition": "accepted",
      "terminal": true,
      "intakeState": "accepted",
      "code": null,
      "detail": null,
      "failedStage": null,
      "qualityScore": 100,
      "recipeVersionId": "recver_d24bf47fe6ad74583616f199_v1",
      "warnings": []
    },
    {
      "candidateId": "scale-7ec23f799c-003-365a08",
      "disposition": "accepted",
      "terminal": true,
      "intakeState": "accepted",
      "code": null,
      "detail": null,
      "failedStage": null,
      "qualityScore": 100,
      "recipeVersionId": "recver_f685e83878d566097c683949_v1",
      "warnings": []
    },
    {
      "candidateId": "scale-7ec23f799c-004-69f768",
      "disposition": "accepted",
      "terminal": true,
      "intakeState": "accepted",
      "code": null,
      "detail": null,
      "failedStage": null,
      "qualityScore": 100,
      "recipeVersionId": "recver_9654b684bbece21f3504e383_v1",
      "warnings": []
    },
    {
      "candidateId": "scale-7ec23f799c-005-aca06c",
      "disposition": "accepted",
      "terminal": true,
      "intakeState": "accepted",
      "code": null,
      "detail": null,
      "failedStage": null,
      "qualityScore": 100,
      "recipeVersionId": "recver_b467db8a797d85ce8992fa93_v1",
      "warnings": []
    },
    {
      "candidateId": "scale-7ec23f799c-006-7ba6fe",
      "disposition": "accepted",
      "terminal": true,
      "intakeState": "accepted",
      "code": null,
      "detail": null,
      "failedStage": null,
      "qualityScore": 100,
      "recipeVersionId": "recver_e689cad634aa67d4dbfb50d7_v1",
      "warnings": []
    },
    {
      "candidateId": "scale-7ec23f799c-007-3ab812",
      "disposition": "accepted",
      "terminal": true,
      "intakeState": "accepted",
      "code": null,
      "detail": null,
      "failedStage": null,
      "qualityScore": 100,
      "recipeVersionId": "recver_0935048391dccf2d7aa097f5_v1",
      "warnings": []
    },
    {
      "candidateId": "scale-7ec23f799c-008-054421",
      "disposition": "accepted",
      "terminal": true,
      "intakeState": "accepted",
      "code": null,
      "detail": null,
      "failedStage": null,
      "qualityScore": 100,
      "recipeVersionId": "recver_1bb94a6ee990170d1579b2c5_v1",
      "warnings": []
    },
    {
      "candidateId": "scale-7ec23f799c-009-00f1e9",
      "disposition": "accepted",
      "terminal": true,
      "intakeState": "accepted",
      "code": null,
      "detail": null,
      "failedStage": null,
      "qualityScore": 100,
      "recipeVersionId": "recver_791d6cf938153324532f277c_v1",
      "warnings": []
    },
    {
      "candidateId": "scale-7ec23f799c-010-90d152",
      "disposition": "accepted",
      "terminal": true,
      "intakeState": "accepted",
      "code": null,
      "detail": null,
      "failedStage": null,
      "qualityScore": 100,
      "recipeVersionId": "recver_13b6cae167702dd194551ae7_v1",
      "warnings": []
    },
    {
      "candidateId": "scale-7ec23f799c-011-4d5f99",
      "disposition": "rejected",
      "terminal": true,
      "intakeState": "rejected",
      "code": "target_already_reached",
      "detail": null,
      "failedStage": "schema_provenance",
      "qualityScore": 95,
      "recipeVersionId": null,
      "warnings": []
    },
    {
      "candidateId": "scale-7ec23f799c-012-7e6967",
      "disposition": "rejected",
      "terminal": true,
      "intakeState": "rejected",
      "code": "target_already_reached",
      "detail": null,
      "failedStage": "schema_provenance",
      "qualityScore": 95,
      "recipeVersionId": null,
      "warnings": []
    },
    {
      "candidateId": "scale-7ec23f799c-013-95e857",
      "disposition": "rejected",
      "terminal": true,
      "intakeState": "rejected",
      "code": "target_already_reached",
      "detail": null,
      "failedStage": "schema_provenance",
      "qualityScore": 95,
      "recipeVersionId": null,
      "warnings": []
    }
  ],
  "batchGate": {
    "status": "pass",
    "targetMet": true,
    "diversityPassed": true,
    "reviewBacklogCount": 0,
    "blockers": []
  },
  "resultDigest": "9b7c136d2a17ccd44c3dd36b1c594017a3fdc892af32c778020b9c3c4703ad70",
  "processedAt": "2026-09-07T08:09:48.631Z"
}
